<?xml version="1.0" encoding="UTF-8"?>
<pointList xmlns="http://www.w3schools.com"
           xmlns:xsi="http://www.w3.org/2001/XMLSchema-instance"
           xsi:schemaLocation="http://www.w3schools.com point.xsd">
    <point units="sm">
        <x>10</x>
        <y>20</y>
    </point>
    <point units="mm">
        <x>3</x>
        <y>5</y>
    </point>
    <point units="px">
        <x>600</x>
        <y>500</y>
    </point>
</pointList>